{
  "version": "0.1.0",
  "last_updated": "2026-08-04",
  "status": "developing_doctrine_architecture",
  "decision_ids": ["CC-DEC-060", "CC-DEC-061"],
  "domain_title": "Resource Sovereignty and Community Stewardship",
  "research_domain_title": "Community Resource Compacts, Progressive Resource Pricing, Local Dividends, and Ecological Restoration",
  "website_node_id": "CC-WEB-ENVIRONMENT",
  "note": "Central developing doctrine. Community Resource Compacts, Local Carbon Restoration Exchange, and Resource and Pollution Ledger are design agendas — not operating products. Illustrative revenue percentages require modeling. No invented water, electricity, emission, or carbon-credit statistics. Detailed statutes blocked until Phase 2.1 sourced modules. Federal GHGRP rules are politically changeable and must not be treated as a permanent floor.",
  "role_in_philosophy": "Land, water, minerals, energy capacity, clean air, soil, infrastructure, and ecological resilience are part of a community’s inherited wealth. Private enterprise may profit from using those resources, but the affected community must receive a direct, permanent, and measurable return. This connects environmental protection, local ownership, household affordability, rural prosperity, regenerative agriculture, energy resilience, and corporate accountability.",
  "central_doctrine": {
    "text": "Natural resources belong first to the place that bears the extraction, consumption, congestion, pollution, and long-term risk. Private enterprise may profit from using those resources, but the affected community must receive a direct, permanent, and measurable return.",
    "doctrine_ids": ["CC-DEV-053"]
  },
  "governing_statement": {
    "text": "Land, water, minerals, energy capacity, clean air, soil, infrastructure, and ecological resilience are part of a community’s inherited wealth. Those who consume them for private gain must pay their full public cost, restore what they damage, and return a fair share of the resulting prosperity to the people and place that made the activity possible.",
    "doctrine_ids": ["CC-DEV-053"]
  },
  "operational_rule": {
    "text": "The greater the consumption, scarcity, risk, or damage, the greater the obligation to the affected community.",
    "doctrine_ids": ["CC-DEV-053"]
  },
  "not_free_inputs": {
    "text": "The system should not treat water, minerals, land, grid capacity, clean air, roads, and soil as free inputs merely because a corporation can obtain a permit.",
    "doctrine_ids": ["CC-DEV-053"]
  },
  "community_resource_compact": {
    "status": "design_agenda",
    "summary": "Every large resource-consuming project would negotiate a binding Community Resource Compact before receiving public approval, incentives, utility commitments, or infrastructure access.",
    "applies_especially_to": [
      "lithium and other mineral extraction",
      "data centers",
      "large warehouses and distribution centers",
      "industrial agriculture and processing",
      "timber extraction",
      "fossil-fuel and energy projects",
      "water-intensive manufacturing",
      "large developments consuming farmland or habitat",
      "facilities creating substantial truck traffic, emissions, waste, or grid demand"
    ],
    "determines": [
      "What resources will the project consume?",
      "What burdens and risks will the community absorb?",
      "What direct benefits will remain in the community?",
      "What restoration obligations continue after the project closes?"
    ],
    "doctrine_ids": ["CC-DEV-054"]
  },
  "progressive_resource_pricing": {
    "summary": "Consumption should not be priced as a flat fee. A small business, family farm, or household should not pay the same marginal rate as a billion-dollar facility consuming extraordinary quantities of water, electricity, land, or road capacity.",
    "tiers": [
      {
        "tier_id": "CC-RES-T01",
        "title": "Essential-use tier",
        "for": [
          "households",
          "small farms",
          "basic local businesses",
          "schools",
          "hospitals",
          "emergency services"
        ],
        "rate": "lowest protected rate"
      },
      {
        "tier_id": "CC-RES-T02",
        "title": "Commercial-use tier",
        "for": ["normal business activity using resources within ordinary local capacity"]
      },
      {
        "tier_id": "CC-RES-T03",
        "title": "Intensive-use tier",
        "for": ["projects consuming substantially above community norms"]
      },
      {
        "tier_id": "CC-RES-T04",
        "title": "Transformative-use tier",
        "for": ["projects whose consumption changes the community’s infrastructure, environment, utility planning, water table, grid demand, traffic, or land use"]
      }
    ],
    "conceptual_formula": "Base resource price + volume surcharge + scarcity surcharge + environmental-risk charge + infrastructure charge + restoration bond.",
    "purpose": "Not merely to collect money — to ensure the business decision includes the real public cost of the project.",
    "pricing_principle": "Essential human use receives protection. Extraordinary commercial use pays its full marginal and community cost.",
    "doctrine_ids": ["CC-DEV-054", "CC-DEV-057"]
  },
  "total_footprint_assessment": {
    "summary": "Charge for the total footprint, not only the resource removed. A lithium operation does not affect only the mineral deposit; a data center does not affect only the electricity meter; a warehouse does not affect only the parcel of land.",
    "includes": [
      "water withdrawal",
      "electricity consumption",
      "direct emissions",
      "electricity-related emissions",
      "truck traffic",
      "road deterioration",
      "noise",
      "light pollution",
      "wastewater",
      "hazardous materials",
      "emergency-service demand",
      "housing pressure",
      "farmland loss",
      "habitat disruption",
      "heat generation",
      "future cleanup",
      "local opportunity cost"
    ],
    "scope_1_scope_2_rule": "Major projects must disclose and price both direct emissions controlled by a facility and indirect emissions associated with purchased electricity, rather than appearing clean simply because emissions occur at a distant power plant.",
    "source_ids": ["CC-SRC-030"],
    "doctrine_ids": ["CC-DEV-054"]
  },
  "community_resource_dividend": {
    "status": "design_agenda",
    "summary": "A large share of every resource charge should remain where the impact occurs, divided into protected accounts.",
    "accounts": [
      {
        "id": "CC-RES-A01",
        "title": "Local Household Dividend",
        "may_reduce": [
          "household utility bills",
          "local property-tax dependence",
          "transportation costs",
          "broadband costs",
          "essential-service fees"
        ]
      },
      {
        "id": "CC-RES-A02",
        "title": "Community Infrastructure Fund",
        "for": [
          "roads",
          "bridges",
          "water systems",
          "schools",
          "emergency services",
          "housing",
          "healthcare",
          "broadband",
          "workforce academies"
        ]
      },
      {
        "id": "CC-RES-A03",
        "title": "Resource Restoration Fund",
        "for": [
          "reclamation",
          "groundwater protection",
          "soil repair",
          "reforestation",
          "habitat restoration",
          "pollution cleanup",
          "long-term monitoring"
        ]
      },
      {
        "id": "CC-RES-A04",
        "title": "Future Generations Fund",
        "summary": "A permanent fund should convert temporary extraction into lasting community wealth so future residents continue receiving benefits after the resource is gone."
      }
    ],
    "illustrative_allocation": {
      "status": "design_discussion_requires_modeling",
      "note": "Percentages are conceptual starters, not locked policy.",
      "shares": [
        { "percent": 40, "label": "Impacted local community" },
        { "percent": 20, "label": "Household cost reduction" },
        { "percent": 15, "label": "Environmental restoration" },
        { "percent": 15, "label": "Permanent community wealth fund" },
        { "percent": 10, "label": "Regional or statewide resilience" }
      ]
    },
    "firm_doctrine": "The majority of geographically concentrated impact revenue must return to the affected place.",
    "doctrine_ids": ["CC-DEV-055"]
  },
  "community_equity": {
    "summary": "Fees can be negotiated away or spent quickly. For exceptionally large projects, the community should receive a continuing ownership interest so it becomes a participant in the project’s success rather than a location rented for extraction.",
    "possible_structures": [
      "a percentage of project revenue",
      "a production royalty",
      "nonvoting community equity",
      "profit participation",
      "shares held by a local public trust",
      "minimum annual payments",
      "appreciation rights if the facility is sold"
    ],
    "doctrine_ids": ["CC-DEV-055"]
  },
  "mineral_extraction_compact": {
    "summary": "Critical minerals are strategically important, but strategic importance should not erase local rights.",
    "federal_context_note": "Interior Department materials recognize the need for mining systems that provide reliable mineral supplies while addressing environmental and social responsibility, Tribal interests, climate risks, and modern standards.",
    "source_ids": ["CC-SRC-031"],
    "requirements": [
      "community and Tribal consultation before final siting",
      "full water-impact analysis",
      "public baseline testing before operations",
      "independent air, soil, and groundwater monitoring",
      "production royalties",
      "local processing where economically and environmentally responsible",